{"allowed_actions":["submit_workorder","launch_workorder","reconcile_run","recover_workorder","finalize_blocked","dead_letter","notify","read_status","health_poll","record_telemetry","operate_service"],"approval_evidence_ref":"owner-qm-continuation-20261029:f068de413c5f7ca786722dece26f9dc9cda3afdd4a87892e521ceedbac1b642d","approver":"jefferson","authorization_id":"AUTH-014-IDR-QM-5B398D2-20261029-V1","expires_utc":"2026-10-29T18:05:39Z","issued_utc":"2026-10-29T11:49:54Z","mode":"PILOT","policy_sha256":"2227de799e3e4abb39384dc13972c413dd77eca3103aa8141659821b1db7c338","schema_version":"1.0","scope":{"driver_classes":["LL"],"models":["qwen3.8:27b-q8_0"],"order_ids":["f014-idr-m1-qm-20261029"],"service_actions":["pause","drain","resume","shutdown"]},"signature_ref":"AUTH-014-IDR-QM-5B398D2-20261029-V1.sig","signed_runbook_ref":"factory-revision:5b398d27f2ee60d3c059dc115dd612f0ff105199"}