{"allowed_actions":["recover_workorder"],"approval_evidence_ref":"owner-standing-afo-aspice-20261030:3e60ba7507f085996b6ae838878a37f4bf5ae2d246fe4d4573c8ed137e519b47","approver":"jefferson","authorization_id":"AUTH-014-RCC-TIME-20261030-V1","expires_utc":"2026-10-30T08:11:56Z","issued_utc":"2026-10-30T00:15:54.401931Z","mode":"PILOT","policy_sha256":"58fb840174df2ec87f3f0a7407178ca1ded2f975c0e8b15b36d6fbf8c225fd51","schema_version":"1.0","scope":{"driver_classes":["LL"],"models":["qwen3.8:27b-q8_0"],"order_ids":["f014-rcc-ll-aspice-20261030-v1"]},"signature_ref":"AUTH-014-RCC-TIME-20261030-V1.sig","signed_runbook_ref":"mission-deadline-extension-014:0d0a1e102f074343a429b3aefe3a647e0abb2b40de6933ef7c8463924770cf7d"}