{"allowed_actions":["submit_workorder","launch_workorder","reconcile_run","recover_workorder","finalize_blocked","dead_letter","notify"],"approval_evidence_ref":"owner-afo-repair-resume-20261029:6c6f06ff072db38e83ad6d45585942759c982c7809471a1db2b357a16b2edc22","approver":"jefferson","authorization_id":"AUTH-014-AFO-MAX-92C49A6-20261029-V4","expires_utc":"2026-10-29T22:25:58Z","issued_utc":"2026-10-29T21:15:59.863150Z","mode":"PILOT","policy_sha256":"f173e0d8088143e46dae5f86f24f06d92f5a21f5a259031236a1894fa4faa8fa","schema_version":"1.0","scope":{"driver_classes":["LL"],"models":["qwen3.8:27b-q8_0"],"order_ids":["f014-afo-mcp-root-repair-20261029-v4"],"service_actions":["pause","drain","resume","shutdown"]},"signature_ref":"AUTH-014-AFO-MAX-92C49A6-20261029-V4.sig","signed_runbook_ref":"qualification-014:6c6f06ff072db38e83ad6d45585942759c982c7809471a1db2b357a16b2edc22"}