{"allowed_actions":["recover_workorder"],"approval_evidence_ref":"owner-qm-continuation-20261029:252141d8903a944b7473b1734ae028d1db2d3dd55fd2847aad76c91c7fdff7d0","approver":"jefferson","authorization_id":"AUTH-014-IDR-QMDEMO-ROLES-15B0FA5-20261029-V1","expires_utc":"2026-10-29T18:05:39Z","issued_utc":"2026-10-29T12:35:20Z","mode":"PILOT","policy_sha256":"580b05ea5af2b7b6fe6260349735977018cfdb3e5dfcf592fea47aec5a6aa204","schema_version":"1.0","scope":{"driver_classes":["LL"],"models":["qwen3.8:27b-q8_0"],"order_ids":["f014-idr-m1-qm-demo-20261029"],"service_actions":["pause","drain","resume","shutdown"]},"signature_ref":"AUTH-014-IDR-QMDEMO-ROLES-15B0FA5-20261029-V1.sig","signed_runbook_ref":"qualification-product-014:03eb497e8852ed967fefcf46c196c48dcab30af180551ebb7f78dc67b8ad70c5"}